{
  "$schema": "../.td2d/schemas/component.schema.json",
  "schemaVersion": "1.0.0",
  "name": "crates",
  "description": "Two honey-oak crates, a small one stacked square on a big one, with a coil of thick twisted rope in front and a tied burlap sack beside them. Each crate has square corner posts, rails, recessed vertical planks, a diagonal brace on each side and a raised lid frame round recessed slats, with grain along every board and nails at every joint.",
  "parts": [
    {
      "type": "box",
      "id": "core",
      "material": "gap",
      "size": [0.61, 0.61, 0.61],
      "position": [0, 0.33, 0]
    },
    {
      "type": "box",
      "id": "plank-front-0",
      "material": "wood",
      "size": [0.0777, 0.5084, 0.03],
      "position": [-0.1954, 0.33, 0.291]
    },
    {
      "type": "box",
      "id": "plank-front-0-grain-0",
      "material": "grain",
      "size": [0.016, 0.2303, 0.008],
      "position": [-0.1829, 0.3532, 0.309]
    },
    {
      "type": "box",
      "id": "plank-front-1",
      "material": "wood",
      "size": [0.0777, 0.5084, 0.03],
      "position": [-0.0977, 0.33, 0.291]
    },
    {
      "type": "box",
      "id": "plank-front-1-grain-0",
      "material": "grain",
      "size": [0.016, 0.2218, 0.008],
      "position": [-0.1129, 0.2093, 0.309]
    },
    {
      "type": "box",
      "id": "plank-front-2",
      "material": "wood",
      "size": [0.0777, 0.5084, 0.03],
      "position": [0.0, 0.33, 0.291]
    },
    {
      "type": "box",
      "id": "plank-front-2-grain-0",
      "material": "grain",
      "size": [0.016, 0.1996, 0.008],
      "position": [-0.0091, 0.266, 0.309]
    },
    {
      "type": "box",
      "id": "plank-front-3",
      "material": "wood",
      "size": [0.0777, 0.5084, 0.03],
      "position": [0.0977, 0.33, 0.291]
    },
    {
      "type": "box",
      "id": "plank-front-3-grain-0",
      "material": "grain",
      "size": [0.016, 0.2549, 0.008],
      "position": [0.0954, 0.3169, 0.309]
    },
    {
      "type": "box",
      "id": "plank-front-4",
      "material": "wood",
      "size": [0.0777, 0.5084, 0.03],
      "position": [0.1954, 0.33, 0.291]
    },
    {
      "type": "box",
      "id": "plank-front-4-grain-0",
      "material": "grain",
      "size": [0.016, 0.2227, 0.008],
      "position": [0.1931, 0.4041, 0.309]
    },
    {
      "type": "box",
      "id": "rail-front-0",
      "material": "frame",
      "size": [0.4984, 0.0858, 0.0686],
      "position": [0.0, 0.0429, 0.2837]
    },
    {
      "type": "box",
      "id": "rail-front-0-grain-0",
      "material": "grain",
      "size": [0.2791, 0.016, 0.008],
      "position": [0.0866, 0.035, 0.321]
    },
    {
      "type": "sphere",
      "id": "rail-front-0-nail-0-0",
      "material": "nail",
      "radius": 0.016,
      "widthSegments": 8,
      "heightSegments": 6,
      "position": [-0.2871, 0.0189, 0.333]
    },
    {
      "type": "sphere",
      "id": "rail-front-0-nail-0-1",
      "material": "nail",
      "radius": 0.016,
      "widthSegments": 8,
      "heightSegments": 6,
      "position": [-0.2871, 0.0669, 0.333]
    },
    {
      "type": "sphere",
      "id": "rail-front-0-nail-1-0",
      "material": "nail",
      "radius": 0.016,
      "widthSegments": 8,
      "heightSegments": 6,
      "position": [0.2871, 0.0189, 0.333]
    },
    {
      "type": "sphere",
      "id": "rail-front-0-nail-1-1",
      "material": "nail",
      "radius": 0.016,
      "widthSegments": 8,
      "heightSegments": 6,
      "position": [0.2871, 0.0669, 0.333]
    },
    {
      "type": "box",
      "id": "rail-front-1",
      "material": "frame",
      "size": [0.4984, 0.0858, 0.0686],
      "position": [0.0, 0.6171, 0.2837]
    },
    {
      "type": "box",
      "id": "rail-front-1-grain-0",
      "material": "grain",
      "size": [0.2472, 0.016, 0.008],
      "position": [0.0002, 0.6258, 0.321]
    },
    {
      "type": "sphere",
      "id": "rail-front-1-nail-0-0",
      "material": "nail",
      "radius": 0.016,
      "widthSegments": 8,
      "heightSegments": 6,
      "position": [-0.2871, 0.5931, 0.333]
    },
    {
      "type": "sphere",
      "id": "rail-front-1-nail-0-1",
      "material": "nail",
      "radius": 0.016,
      "widthSegments": 8,
      "heightSegments": 6,
      "position": [-0.2871, 0.6411, 0.333]
    },
    {
      "type": "sphere",
      "id": "rail-front-1-nail-1-0",
      "material": "nail",
      "radius": 0.016,
      "widthSegments": 8,
      "heightSegments": 6,
      "position": [0.2871, 0.5931, 0.333]
    },
    {
      "type": "sphere",
      "id": "rail-front-1-nail-1-1",
      "material": "nail",
      "radius": 0.016,
      "widthSegments": 8,
      "heightSegments": 6,
      "position": [0.2871, 0.6411, 0.333]
    },
    {
      "type": "box",
      "id": "brace-front",
      "material": "frame",
      "size": [0.6564, 0.0644, 0.03],
      "position": [0.0, 0.33, 0.318],
      "rotation": [0, 0, 45.0]
    },
    {
      "type": "box",
      "id": "plank-right-0",
      "material": "wood",
      "size": [0.03, 0.5084, 0.0777],
      "position": [0.291, 0.33, 0.1954]
    },
    {
      "type": "box",
      "id": "plank-right-0-grain-0",
      "material": "grain",
      "size": [0.008, 0.215, 0.016],
      "position": [0.309, 0.3144, 0.1835]
    },
    {
      "type": "box",
      "id": "plank-right-1",
      "material": "wood",
      "size": [0.03, 0.5084, 0.0777],
      "position": [0.291, 0.33, 0.0977]
    },
    {
      "type": "box",
      "id": "plank-right-1-grain-0",
      "material": "grain",
      "size": [0.008, 0.2744, 0.016],
      "position": [0.309, 0.3431, 0.0852]
    },
    {
      "type": "box",
      "id": "plank-right-2",
      "material": "wood",
      "size": [0.03, 0.5084, 0.0777],
      "position": [0.291, 0.33, 0.0]
    },
    {
      "type": "box",
      "id": "plank-right-2-grain-0",
      "material": "grain",
      "size": [0.008, 0.2758, 0.016],
      "position": [0.309, 0.2587, -0.0126]
    },
    {
      "type": "box",
      "id": "plank-right-3",
      "material": "wood",
      "size": [0.03, 0.5084, 0.0777],
      "position": [0.291, 0.33, -0.0977]
    },
    {
      "type": "box",
      "id": "plank-right-3-grain-0",
      "material": "grain",
      "size": [0.008, 0.2687, 0.016],
      "position": [0.309, 0.3285, -0.1111]
    },
    {
      "type": "box",
      "id": "plank-right-4",
      "material": "wood",
      "size": [0.03, 0.5084, 0.0777],
      "position": [0.291, 0.33, -0.1954]
    },
    {
      "type": "box",
      "id": "plank-right-4-grain-0",
      "material": "grain",
      "size": [0.008, 0.3285, 0.016],
      "position": [0.309, 0.269, -0.1881]
    },
    {
      "type": "box",
      "id": "rail-right-0",
      "material": "frame",
      "size": [0.0686, 0.0858, 0.4984],
      "position": [0.2837, 0.0429, 0.0]
    },
    {
      "type": "box",
      "id": "rail-right-0-grain-0",
      "material": "grain",
      "size": [0.008, 0.016, 0.282],
      "position": [0.321, 0.0418, 0.0274]
    },
    {
      "type": "sphere",
      "id": "rail-right-0-nail-0-0",
      "material": "nail",
      "radius": 0.016,
      "widthSegments": 8,
      "heightSegments": 6,
      "position": [0.333, 0.0189, 0.2871]
    },
    {
      "type": "sphere",
      "id": "rail-right-0-nail-0-1",
      "material": "nail",
      "radius": 0.016,
      "widthSegments": 8,
      "heightSegments": 6,
      "position": [0.333, 0.0669, 0.2871]
    },
    {
      "type": "sphere",
      "id": "rail-right-0-nail-1-0",
      "material": "nail",
      "radius": 0.016,
      "widthSegments": 8,
      "heightSegments": 6,
      "position": [0.333, 0.0189, -0.2871]
    },
    {
      "type": "sphere",
      "id": "rail-right-0-nail-1-1",
      "material": "nail",
      "radius": 0.016,
      "widthSegments": 8,
      "heightSegments": 6,
      "position": [0.333, 0.0669, -0.2871]
    },
    {
      "type": "box",
      "id": "rail-right-1",
      "material": "frame",
      "size": [0.0686, 0.0858, 0.4984],
      "position": [0.2837, 0.6171, 0.0]
    },
    {
      "type": "box",
      "id": "rail-right-1-grain-0",
      "material": "grain",
      "size": [0.008, 0.016, 0.1943],
      "position": [0.321, 0.6152, 0.0051]
    },
    {
      "type": "sphere",
      "id": "rail-right-1-nail-0-0",
      "material": "nail",
      "radius": 0.016,
      "widthSegments": 8,
      "heightSegments": 6,
      "position": [0.333, 0.5931, 0.2871]
    },
    {
      "type": "sphere",
      "id": "rail-right-1-nail-0-1",
      "material": "nail",
      "radius": 0.016,
      "widthSegments": 8,
      "heightSegments": 6,
      "position": [0.333, 0.6411, 0.2871]
    },
    {
      "type": "sphere",
      "id": "rail-right-1-nail-1-0",
      "material": "nail",
      "radius": 0.016,
      "widthSegments": 8,
      "heightSegments": 6,
      "position": [0.333, 0.5931, -0.2871]
    },
    {
      "type": "sphere",
      "id": "rail-right-1-nail-1-1",
      "material": "nail",
      "radius": 0.016,
      "widthSegments": 8,
      "heightSegments": 6,
      "position": [0.333, 0.6411, -0.2871]
    },
    {
      "type": "box",
      "id": "brace-right",
      "material": "frame",
      "size": [0.03, 0.0644, 0.6564],
      "position": [0.318, 0.33, 0.0],
      "rotation": [-45.0, 0, 0]
    },
    {
      "type": "box",
      "id": "plank-back-0",
      "material": "wood",
      "size": [0.0777, 0.5084, 0.03],
      "position": [0.1954, 0.33, -0.291]
    },
    {
      "type": "box",
      "id": "plank-back-0-grain-0",
      "material": "grain",
      "size": [0.016, 0.2924, 0.008],
      "position": [0.1816, 0.297, -0.309]
    },
    {
      "type": "box",
      "id": "plank-back-1",
      "material": "wood",
      "size": [0.0777, 0.5084, 0.03],
      "position": [0.0977, 0.33, -0.291]
    },
    {
      "type": "box",
      "id": "plank-back-1-grain-0",
      "material": "grain",
      "size": [0.016, 0.3701, 0.008],